{"base_now_ms":1800000001000,"base_snapshot":{"bootstrap_authority_id":"bootstrap-main","bootstrap_key_id":"bootstrap-key-1","canonical_profile":"rfc8785-safe-integer/v0.10","generation":2,"issued_at_ms":1800000000000,"issuer_id":"root-issuer","not_after_ms":1800000101000,"not_before_ms":1799999991000,"policy_version":"policy-2","previous_snapshot_digest":"f18604c121decc7cae98b33cb4303d78e1ecf1232197013f3958dd2b3a514979","profile_id":"vtl-canonical-trust-root-snapshot-v0.12","schema_version":"vtl.canonical-trust-root-snapshot/v0.12","signature":"QCT4JQkE18CVxQJPfd5qdUWuAKfLbccpEjcJIaG0gJwXpqkiDqrL/1T4CdJ28aE1wD/c0G1WJe3J72RH54ZRBw==","signature_algorithm":"ED25519","snapshot_id":"snapshot_4df45b870f53e40dc366c4b1","trust_root":{"allowed_algorithms":["ED25519"],"keys":[{"algorithm":"ED25519","issuer_id":"runtime-A","not_after_ms":1900000000000,"not_before_ms":1790000000000,"public_key_base64":"AAAAAAAAAAAAAAAAAAAAAAAAAAAAAAAAAAAAAAAAAAA=","revoked":false,"signer_key_id":"signer-main"}],"policy_version":"policy-2","profile_id":"vtl-canonical-trust-root/v0.11","trust_root_id":"root-main"},"trust_root_digest":"e0fab33709f1ec071a1fc5e010af4933cec9601f279f237a7b7430b765f4d076","trust_root_id":"root-main"},"bootstrap_authority":{"allowed_algorithms":["ED25519"],"bootstrap_authority_id":"bootstrap-main","keys":[{"algorithm":"ED25519","bootstrap_key_id":"bootstrap-key-1","issuer_id":"root-issuer","not_after_ms":1900000000000,"not_before_ms":1790000000000,"public_key_base64":"ebVWLo/mVPlAeLES6KmLp5AfhTrmlb7X4OORC60ElmQ=","revoked":false}],"profile_id":"vtl-canonical-bootstrap-authority/v0.12"},"canonical_profile":"rfc8785-safe-integer/v0.10","cases":[{"checkpoint_ref":"base","expected":{"bootstrap_authority_valid":true,"bootstrap_signature_valid":true,"canonical_profile_valid":true,"continuity_valid":true,"freshness_valid":true,"reason_codes":[],"snapshot_integrity_valid":true,"valid":true},"id":"valid-fresh"},{"checkpoint_ref":"base","expected":{"bootstrap_authority_valid":true,"bootstrap_signature_valid":false,"canonical_profile_valid":true,"continuity_valid":true,"freshness_valid":true,"reason_codes":["SNAPSHOT_SIGNATURE_INVALID"],"snapshot_integrity_valid":true,"valid":false},"id":"bad-bootstrap-signature","snapshot_mutations":[{"path":"signature","value":"AAAAAAAAAAAAAAAAAAAAAAAAAAAAAAAAAAAAAAAAAAAAAAAAAAAAAAAAAAAAAAAAAAAAAAAAAAAAAAAAAAAAAA=="}]},{"bootstrap_mutations":[{"path":"keys.0.bootstrap_key_id","value":"other-key"}],"checkpoint_ref":"base","expected":{"bootstrap_authority_valid":false,"bootstrap_signature_valid":false,"canonical_profile_valid":true,"continuity_valid":true,"freshness_valid":true,"reason_codes":["BOOTSTRAP_KEY_NOT_TRUSTED"],"snapshot_integrity_valid":true,"valid":false},"id":"unknown-bootstrap-key"},{"bootstrap_mutations":[{"path":"keys","value":[{"algorithm":"ED25519","bootstrap_key_id":"bootstrap-key-1","issuer_id":"root-issuer","not_after_ms":1900000000000,"not_before_ms":1790000000000,"public_key_base64":"ebVWLo/mVPlAeLES6KmLp5AfhTrmlb7X4OORC60ElmQ=","revoked":false},{"algorithm":"ED25519","bootstrap_key_id":"bootstrap-key-1","issuer_id":"root-issuer","not_after_ms":1900000000000,"not_before_ms":1790000000000,"public_key_base64":"ebVWLo/mVPlAeLES6KmLp5AfhTrmlb7X4OORC60ElmQ=","revoked":false}]}],"checkpoint_ref":"base","expected":{"bootstrap_authority_valid":false,"bootstrap_signature_valid":false,"canonical_profile_valid":true,"continuity_valid":true,"freshness_valid":true,"reason_codes":["BOOTSTRAP_KEY_AMBIGUOUS"],"snapshot_integrity_valid":true,"valid":false},"id":"ambiguous-bootstrap-key"},{"bootstrap_mutations":[{"path":"keys.0.public_key_base64","value":"AAAA"}],"checkpoint_ref":"base","expected":{"bootstrap_authority_valid":false,"bootstrap_signature_valid":false,"canonical_profile_valid":true,"continuity_valid":true,"freshness_valid":true,"reason_codes":["BOOTSTRAP_KEY_MATERIAL_INVALID"],"snapshot_integrity_valid":true,"valid":false},"id":"malformed-bootstrap-key"},{"bootstrap_mutations":[{"path":"keys.0.revoked","value":true}],"checkpoint_ref":"base","expected":{"bootstrap_authority_valid":false,"bootstrap_signature_valid":true,"canonical_profile_valid":true,"continuity_valid":true,"freshness_valid":true,"reason_codes":["BOOTSTRAP_KEY_REVOKED"],"snapshot_integrity_valid":true,"valid":false},"id":"revoked-bootstrap-key"},{"checkpoint_ref":"base","expected":{"bootstrap_authority_valid":true,"bootstrap_signature_valid":true,"canonical_profile_valid":true,"continuity_valid":true,"freshness_valid":false,"reason_codes":["SNAPSHOT_EXPIRED"],"snapshot_integrity_valid":true,"valid":false},"id":"expired-snapshot","variant_ref":"expired"},{"checkpoint_ref":"base","expected":{"bootstrap_authority_valid":true,"bootstrap_signature_valid":true,"canonical_profile_valid":true,"continuity_valid":true,"freshness_valid":false,"reason_codes":["SNAPSHOT_NOT_YET_VALID","SNAPSHOT_ISSUED_IN_FUTURE"],"snapshot_integrity_valid":true,"valid":false},"id":"not-yet-valid-snapshot","variant_ref":"future"},{"checkpoint_ref":"floor2","expected":{"bootstrap_authority_valid":true,"bootstrap_signature_valid":true,"canonical_profile_valid":true,"continuity_valid":true,"freshness_valid":false,"reason_codes":["SNAPSHOT_GENERATION_BELOW_FLOOR"],"snapshot_integrity_valid":true,"valid":false},"id":"generation-below-floor","variant_ref":"historical"},{"checkpoint_ref":"known_gen2","expected":{"bootstrap_authority_valid":true,"bootstrap_signature_valid":true,"canonical_profile_valid":true,"continuity_valid":false,"freshness_valid":true,"reason_codes":["SNAPSHOT_ROLLBACK"],"snapshot_integrity_valid":true,"valid":false},"id":"rollback-old-signed-generation","variant_ref":"historical"},{"checkpoint_ref":"base","expected":{"bootstrap_authority_valid":true,"bootstrap_signature_valid":true,"canonical_profile_valid":true,"continuity_valid":false,"freshness_valid":true,"reason_codes":["SNAPSHOT_FORK_DETECTED"],"snapshot_integrity_valid":true,"valid":false},"id":"same-generation-fork","variant_ref":"fork"},{"checkpoint_ref":"base","expected":{"bootstrap_authority_valid":true,"bootstrap_signature_valid":true,"canonical_profile_valid":true,"continuity_valid":false,"freshness_valid":true,"reason_codes":["PREVIOUS_SNAPSHOT_DIGEST_MISMATCH"],"snapshot_integrity_valid":true,"valid":false},"id":"wrong-predecessor-digest","variant_ref":"wrong_predecessor"},{"checkpoint_ref":"base","expected":{"bootstrap_authority_valid":true,"bootstrap_signature_valid":true,"canonical_profile_valid":true,"continuity_valid":false,"freshness_valid":true,"reason_codes":["SNAPSHOT_CONTINUITY_GAP"],"snapshot_integrity_valid":true,"valid":false},"id":"continuity-gap","variant_ref":"gap"},{"checkpoint_ref":"base","expected":{"bootstrap_authority_valid":true,"bootstrap_signature_valid":true,"canonical_profile_valid":true,"continuity_valid":false,"freshness_valid":true,"reason_codes":["TRUST_ROOT_ID_MISMATCH","CHECKPOINT_TRUST_ROOT_MISMATCH"],"snapshot_integrity_valid":false,"valid":false},"id":"trust-root-id-mismatch","variant_ref":"root_id_mismatch"},{"checkpoint_ref":"base","expected":{"bootstrap_authority_valid":true,"bootstrap_signature_valid":true,"canonical_profile_valid":true,"continuity_valid":true,"freshness_valid":true,"reason_codes":["TRUST_POLICY_VERSION_MISMATCH"],"snapshot_integrity_valid":false,"valid":false},"id":"policy-version-mismatch","variant_ref":"policy_mismatch"},{"checkpoint_ref":"base","expected":{"bootstrap_authority_valid":true,"bootstrap_signature_valid":true,"canonical_profile_valid":false,"continuity_valid":true,"freshness_valid":true,"reason_codes":["CANONICAL_PROFILE_MISMATCH"],"snapshot_integrity_valid":false,"valid":false},"id":"canonical-profile-mismatch","variant_ref":"bad_profile"},{"checkpoint_ref":"base","expected":{"bootstrap_authority_valid":true,"bootstrap_signature_valid":true,"canonical_profile_valid":true,"continuity_valid":true,"freshness_valid":true,"reason_codes":["TRUST_ROOT_DIGEST_MISMATCH"],"snapshot_integrity_valid":false,"valid":false},"id":"trust-root-payload-tamper","snapshot_mutations":[{"path":"trust_root.keys.0.revoked","value":true}]},{"checkpoint_mutations":[{"path":"checkpointed_at_ms","value":1800000001001}],"checkpoint_ref":"base","expected":{"bootstrap_authority_valid":true,"bootstrap_signature_valid":true,"canonical_profile_valid":true,"continuity_valid":true,"freshness_valid":false,"reason_codes":["CHECKPOINT_FROM_FUTURE"],"snapshot_integrity_valid":true,"valid":false},"id":"checkpoint-from-future"},{"checkpoint_mutations":[{"path":"known_generation","value":null}],"checkpoint_ref":"base","expected":{"bootstrap_authority_valid":false,"bootstrap_signature_valid":false,"canonical_profile_valid":false,"continuity_valid":false,"freshness_valid":false,"reason_codes":["CHECKPOINT_KNOWN_STATE_INCOMPLETE"],"snapshot_integrity_valid":false,"valid":false},"id":"checkpoint-known-state-incomplete"},{"checkpoint_ref":"base","expected":{"bootstrap_authority_valid":false,"bootstrap_signature_valid":false,"canonical_profile_valid":true,"continuity_valid":true,"freshness_valid":true,"reason_codes":["BOOTSTRAP_ALGORITHM_NOT_ALLOWED","BOOTSTRAP_KEY_ALGORITHM_MISMATCH"],"snapshot_integrity_valid":true,"valid":false},"id":"algorithm-substitution","variant_ref":"algorithm_substitution"}],"checkpoints":{"base":{"checkpointed_at_ms":1800000000500,"known_generation":1,"known_snapshot_digest":"f18604c121decc7cae98b33cb4303d78e1ecf1232197013f3958dd2b3a514979","minimum_generation":1,"profile_id":"vtl-canonical-trust-checkpoint/v0.12","trust_root_id":"root-main"},"floor2":{"checkpointed_at_ms":1800000000500,"known_generation":1,"known_snapshot_digest":"f18604c121decc7cae98b33cb4303d78e1ecf1232197013f3958dd2b3a514979","minimum_generation":2,"profile_id":"vtl-canonical-trust-checkpoint/v0.12","trust_root_id":"root-main"},"known_gen2":{"checkpointed_at_ms":1800000000500,"known_generation":2,"known_snapshot_digest":"4b41718945f3d9509d818a6be8e928ac581443e966777f94a4eb98a8b4d1338a","minimum_generation":1,"profile_id":"vtl-canonical